"Document Name","Document Category","Document Location","Description"
"AutoPolicy2023","Policy Updates","https://www.progressive.com/AutoPolicy2023.pdf","Details the recent changes to auto insurance policies for the year 2023."
"RoadsideAssistanceGuide","Product Information","https://www.progressive.com/RoadsideAssistanceGuide.pdf","Guide to the roadside assistance service offered by Progressive Insurance."
"HomeAutoBundleStrategy","Product Strategy","https://www.progressive.com/HomeAutoBundleStrategy.pdf","Outlines our strategy for promoting bundled home and auto insurance products."
"FraudPreventionPolicy","Fraud Prevention","https://www.progressive.com/FraudPreventionPolicy.pdf","Details our methods and strategies for identifying and preventing insurance fraud."
"CustomerClaimProcess","Claim Process","https://www.progressive.com/CustomerClaimProcess.pdf","Step-by-step guide on how customers should proceed after an accident."
"PremiumCalculation","Underwriting","https://www.progressive.com/PremiumCalculation.pdf","Outlines the factors and methods used in calculating insurance premiums."
"AgentTrainingManual","Training","https://www.progressive.com/AgentTrainingManual.pdf","Comprehensive training guide for new insurance agents."
"DisasterResponsePlan","Crisis Management","https://www.progressive.com/DisasterResponsePlan.pdf","Our comprehensive plan for responding to large-scale disasters and crises."
"TeenDriverPolicy","Policy Updates","https://www.progressive.com/TeenDriverPolicy.pdf","Updates to our policies regarding insuring teen drivers."
"CommercialInsuranceOverview","Product Information","https://www.progressive.com/CommercialInsuranceOverview.pdf","An overview of our commercial auto insurance offerings."
"RVInsurance2024","Product Information","https://www.progressive.com/RVInsurance2024.pdf","Provides information on our RV insurance offerings for the year 2024."
"CyberSecurityPolicy","Policy Updates","https://www.progressive.com/CyberSecurityPolicy.pdf","Outlines our updated measures for securing customer information."
"SmallBusinessInsuranceGuide","Product Strategy","https://www.progressive.com/SmallBusinessInsuranceGuide.pdf","Strategy for expanding our small business insurance offerings."
"AntiDiscriminationPolicy","Policy Updates","https://www.progressive.com/AntiDiscriminationPolicy.pdf","Policy update on measures to prevent discrimination in service provision."
"ClaimDisputeResolution","Claim Process","https://www.progressive.com/ClaimDisputeResolution.pdf","Details the process for customers to dispute a claim decision."
"PremiumPaymentOptions","Policy Updates","https://www.progressive.com/PremiumPaymentOptions.pdf","Explains the various options available for customers to pay their premiums."
"MotorcycleInsuranceStrategy","Product Strategy","https://www.progressive.com/MotorcycleInsuranceStrategy.pdf","Strategy for marketing and improving our motorcycle insurance product."
"EmployeeCodeOfConduct","Training","https://www.progressive.com/EmployeeCodeOfConduct.pdf","Outlines the expected behavior and standards for all Progressive employees."
"NaturalDisasterCoverage","Policy Updates","https://www.progressive.com/NaturalDisasterCoverage.pdf","Details coverage options and exclusions related to natural disasters."
"OnlineQuoteSystemGuide","Training","https://www.progressive.com/OnlineQuoteSystemGuide.pdf","A guide for agents to navigate the online quote system."
"ClassicCarInsuranceOverview","Product Information","https://www.progressive.com/ClassicCarInsuranceOverview.pdf","Overview of insurance options for classic and vintage cars."
"DataPrivacyPolicy","Policy Updates","https://www.progressive.com/DataPrivacyPolicy.pdf","Outlines how we handle and protect customer data."
"BoatInsuranceStrategy","Product Strategy","https://www.progressive.com/BoatInsuranceStrategy.pdf","Details our strategy for promoting boat insurance."
"NewAgentOnboarding","Training","https://www.progressive.com/NewAgentOnboarding.pdf","Guide for new agents on company culture and expectations."
"ClaimFraudDetection","Fraud Prevention","https://www.progressive.com/ClaimFraudDetection.pdf","Outlines our process for detecting fraudulent claims."
"MultiPolicyDiscounts","Policy Updates","https://www.progressive.com/MultiPolicyDiscounts.pdf","Explains discounts available to customers with multiple policies."
"RideshareInsuranceGuide","Product Information","https://www.progressive.com/RideshareInsuranceGuide.pdf","Guide to our insurance products for rideshare drivers."
"AccidentForgivenessPolicy","Policy Updates","https://www.progressive.com/AccidentForgivenessPolicy.pdf","Details our policy on accident forgiveness."
"RiskAssessmentTraining","Training","https://www.progressive.com/RiskAssessmentTraining.pdf","Training material for agents on conducting risk assessments."
"EcoFriendlyInitiatives","Corporate Strategy","https://www.progressive.com/EcoFriendlyInitiatives.pdf","Outlines our initiatives to reduce our environmental impact."
"PetInjuryCoverage","Policy Updates","https://www.progressive.com/PetInjuryCoverage.pdf","Provides details on our pet injury coverage in auto policies."
"GapInsuranceStrategy","Product Strategy","https://www.progressive.com/GapInsuranceStrategy.pdf","Outlines our strategy for offering and promoting gap insurance."
"DigitalTransformationPlan","Corporate Strategy","https://www.progressive.com/DigitalTransformationPlan.pdf","Details our plan for digital transformation and modernization."
"WorkersCompensationGuide","Product Information","https://www.progressive.com/WorkersCompensationGuide.pdf","Details about our Workers' Compensation insurance product."
"DiversityInclusionStrategy","Corporate Strategy","https://www.progressive.com/DiversityInclusionStrategy.pdf","Strategy outlining our commitment to diversity and inclusion within the company."
"TelematicsProgramOverview","Product Strategy","https://www.progressive.com/TelematicsProgramOverview.pdf","Overview of our telematics-based insurance program and its benefits."
"AgentPerformanceMetrics","Training","https://www.progressive.com/AgentPerformanceMetrics.pdf","Provides information on how agent performance is measured."
"AIInClaimsProcessing","Corporate Strategy","https://www.progressive.com/AIInClaimsProcessing.pdf","Details our strategy for integrating AI technology in claims processing."
"CustomerRetentionStrategy","Corporate Strategy","https://www.progressive.com/CustomerRetentionStrategy.pdf","Outlines our plan for retaining customers and improving customer loyalty."
"Document Name","Document Category","Document Location","Description"
"CommercialAutoPolicy","Policy Updates","https://www.progressive.com/CommercialAutoPolicy.pdf","Details the terms of our commercial auto insurance policy."
"BusinessOwnersPolicyGuide","Product Information","https://www.progressive.com/BusinessOwnersPolicyGuide.pdf","Guide to our Business Owners Policy insurance product."
"CommercialPropertyInsuranceStrategy","Product Strategy","https://www.progressive.com/CommercialPropertyInsuranceStrategy.pdf","Strategy for marketing and selling commercial property insurance."
"CommercialClaimsProcess","Claim Process","https://www.progressive.com/CommercialClaimsProcess.pdf","Overview of the claims process for commercial insurance policies."
"WorkersCompensationPolicy","Policy Updates","https://www.progressive.com/WorkersCompensationPolicy.pdf","Details our policy on Workers' Compensation insurance."
"GeneralLiabilityInsuranceGuide","Product Information","https://www.progressive.com/GeneralLiabilityInsuranceGuide.pdf","Guide to our General Liability insurance product for businesses."
"ProfessionalLiabilityStrategy","Product Strategy","https://www.progressive.com/ProfessionalLiabilityStrategy.pdf","Strategy for marketing and selling professional liability insurance."
"CommercialInsuranceFraudPrevention","Fraud Prevention","https://www.progressive.com/CommercialInsuranceFraudPrevention.pdf","Outlines our approach to preventing fraud in commercial insurance."
"CommercialInsuranceUnderwriting","Underwriting","https://www.progressive.com/CommercialInsuranceUnderwriting.pdf","Details the factors and methods used in underwriting commercial insurance policies."
"BusinessInterruptionCoverage","Policy Updates","https://www.progressive.com/BusinessInterruptionCoverage.pdf","Details our coverage options for business interruption."
"EquipmentBreakdownInsurance","Product Information","https://www.progressive.com/EquipmentBreakdownInsurance.pdf","Provides information on our equipment breakdown insurance offerings."
"CommercialCyberLiabilityStrategy","Product Strategy","https://www.progressive.com/CommercialCyberLiabilityStrategy.pdf","Strategy for promoting our cyber liability insurance for businesses."
"CommercialInsuranceTraining","Training","https://www.progressive.com/CommercialInsuranceTraining.pdf","Training material for agents selling commercial insurance."
"BusinessUmbrellaPolicy","Policy Updates","https://www.progressive.com/BusinessUmbrellaPolicy.pdf","Details our umbrella insurance policy for businesses."
"CommercialFleetInsuranceGuide","Product Information","https://www.progressive.com/CommercialFleetInsuranceGuide.pdf","Guide to our insurance offerings for commercial vehicle fleets."
"CommercialPremiumPaymentOptions","Policy Updates","https://www.progressive.com/CommercialPremiumPaymentOptions.pdf","Explains the various options available for businesses to pay their premiums."
"DirectorsOfficersInsuranceStrategy","Product Strategy","https://www.progressive.com/DirectorsOfficersInsuranceStrategy.pdf","Strategy for marketing and selling Directors & Officers insurance."
"BusinessInsuranceClaimFraudDetection","Fraud Prevention","https://www.progressive.com/BusinessInsuranceClaimFraudDetection.pdf","Outlines our process for detecting fraudulent claims in business insurance."
"RiskAssessmentForBusinesses","Underwriting","https://www.progressive.com/RiskAssessmentForBusinesses.pdf","Details our risk assessment process for insuring businesses."
"CommercialInsuranceBundlingOptions","Policy Updates","https://www.progressive.com/CommercialInsuranceBundlingOptions.pdf","Details our options for bundling different commercial insurance policies."
"CommercialMarineInsuranceGuide","Product Information","https://www.progressive.com/CommercialMarineInsuranceGuide.pdf","Guide to our marine insurance offerings for businesses."
"CommercialEarthquakeInsuranceStrategy","Product Strategy","https://www.progressive.com/CommercialEarthquakeInsuranceStrategy.pdf","Strategy for promoting our earthquake insurance for businesses."
"Document Name","Document Category","Document Location","Description"
"FloridaAutoInsuranceRequirements","Policy Updates","https://www.progressive.com/FloridaAutoInsuranceRequirements.pdf","Outlines the state-required minimums for auto insurance in Florida."
"FloridaFloodInsuranceGuide","Product Information","https://www.progressive.com/FloridaFloodInsuranceGuide.pdf","Guide to flood insurance in Florida, including information about FEMA flood zones."
"FloridaHomeInsurancePolicy","Policy Updates","https://www.progressive.com/FloridaHomeInsurancePolicy.pdf","Details our home insurance policy for customers in Florida."
"FloridaPIPInsurance","Product Information","https://www.progressive.com/FloridaPIPInsurance.pdf","Guide to Personal Injury Protection (PIP) insurance in Florida."
"FloridaCommercialAutoInsurance","Policy Updates","https://www.progressive.com/FloridaCommercialAutoInsurance.pdf","Explains the requirements for commercial auto insurance in Florida."
"FloridaInsuranceFraudPrevention","Fraud Prevention","https://www.progressive.com/FloridaInsuranceFraudPrevention.pdf","Details our strategies for preventing insurance fraud in Florida."
"FloridaRideshareInsurancePolicy","Policy Updates","https://www.progressive.com/FloridaRideshareInsurancePolicy.pdf","Outlines our policy for rideshare insurance in Florida."
"FloridaBoatInsuranceGuide","Product Information","https://www.progressive.com/FloridaBoatInsuranceGuide.pdf","A guide to our boat insurance offerings in Florida."
"FloridaMotorcycleInsurancePolicy","Policy Updates","https://www.progressive.com/FloridaMotorcycleInsurancePolicy.pdf","Details our motorcycle insurance policy for customers in Florida."
"FloridaHurricaneCoverage","Product Information","https://www.progressive.com/FloridaHurricaneCoverage.pdf","Provides information on our hurricane coverage in Florida."
"FloridaWorkersCompensationRequirements","Policy Updates","https://www.progressive.com/FloridaWorkersCompensationRequirements.pdf","Details the state-required minimums for Workers' Compensation insurance in Florida."
"FloridaCondoInsuranceGuide","Product Information","https://www.progressive.com/FloridaCondoInsuranceGuide.pdf","Guide to our condo insurance offerings in Florida."
"FloridaTeenDriverPolicy","Policy Updates","https://www.progressive.com/FloridaTeenDriverPolicy.pdf","Details our policy for insuring teen drivers in Florida."
"FloridaClaimProcess","Claim Process","https://www.progressive.com/FloridaClaimProcess.pdf","Overview of the claims process for customers in Florida."
"FloridaCommercialPropertyInsurance","Policy Updates","https://www.progressive.com/FloridaCommercialPropertyInsurance.pdf","Outlines our policy for commercial property insurance in Florida."
"FloridaUnderwritingRules","Underwriting","https://www.progressive.com/FloridaUnderwritingRules.pdf","Details our rules for underwriting insurance policies in Florida."
"FloridaGeneralLiabilityInsurance","Policy Updates","https://www.progressive.com/FloridaGeneralLiabilityInsurance.pdf","Details our general liability insurance policy for customers in Florida."
"FloridaBusinessOwnersPolicy","Policy Updates","https://www.progressive.com/FloridaBusinessOwnersPolicy.pdf","Outlines our Business Owners Policy for customers in Florida."
"FloridaRVInsuranceGuide","Product Information","https://www.progressive.com/FloridaRVInsuranceGuide.pdf","Guide to our RV insurance offerings in Florida."
"FloridaNaturalDisasterCoverage","Policy Updates","https://www.progressive.com/FloridaNaturalDisasterCoverage.pdf","Details our coverage options related to natural disasters in Florida."
"Document Name","Document Category","Document Location","Description"
"CaliforniaAutoInsuranceRequirements","Policy Updates","https://www.progressive.com/CaliforniaAutoInsuranceRequirements.pdf","Details the minimum required coverage for auto insurance in California."
"TexasHomeInsuranceRequirements","Policy Updates","https://www.progressive.com/TexasHomeInsuranceRequirements.pdf","Details the minimum required coverage for home insurance in Texas."
"NewYorkMotorcycleInsuranceRequirements","Policy Updates","https://www.progressive.com/NewYorkMotorcycleInsuranceRequirements.pdf","Details the minimum required coverage for motorcycle insurance in New York."
"OhioCommercialAutoInsuranceRequirements","Policy Updates","https://www.progressive.com/OhioCommercialAutoInsuranceRequirements.pdf","Details the minimum required coverage for commercial auto insurance in Ohio."
"WashingtonBoatInsuranceRequirements","Policy Updates","https://www.progressive.com/WashingtonBoatInsuranceRequirements.pdf","Details the minimum required coverage for boat insurance in Washington."
"CaliforniaHomeInsuranceRequirements","Policy Updates","https://www.progressive.com/CaliforniaHomeInsuranceRequirements.pdf","Details the minimum required coverage for home insurance in California."
"TexasMotorcycleInsuranceRequirements","Policy Updates","https://www.progressive.com/TexasMotorcycleInsuranceRequirements.pdf","Details the minimum required coverage for motorcycle insurance in Texas."
"NewYorkCommercialAutoInsuranceRequirements","Policy Updates","https://www.progressive.com/NewYorkCommercialAutoInsuranceRequirements.pdf","Details the minimum required coverage for commercial auto insurance in New York."
"OhioBoatInsuranceRequirements","Policy Updates","https://www.progressive.com/OhioBoatInsuranceRequirements.pdf","Details the minimum required coverage for boat insurance in Ohio."
"WashingtonAutoInsuranceRequirements","Policy Updates","https://www.progressive.com/WashingtonAutoInsuranceRequirements.pdf","Details the minimum required coverage for auto insurance in Washington."
"CaliforniaMotorcycleInsuranceRequirements","Policy Updates","https://www.progressive.com/CaliforniaMotorcycleInsuranceRequirements.pdf","Details the minimum required coverage for motorcycle insurance in California."
"TexasCommercialAutoInsuranceRequirements","Policy Updates","https://www.progressive.com/TexasCommercialAutoInsuranceRequirements.pdf","Details the minimum required coverage for commercial auto insurance in Texas."
"NewYorkBoatInsuranceRequirements","Policy Updates","https://www.progressive.com/NewYorkBoatInsuranceRequirements.pdf","Details the minimum required coverage for boat insurance in New York."
"OhioAutoInsuranceRequirements","Policy Updates","https://www.progressive.com/OhioAutoInsuranceRequirements.pdf","Details the minimum required coverage for auto insurance in Ohio."
"WashingtonHomeInsuranceRequirements","Policy Updates","https://www.progressive.com/WashingtonHomeInsuranceRequirements.pdf","Details the minimum required coverage for home insurance in Washington."
"CaliforniaCommercialAutoInsuranceRequirements","Policy Updates","https://www.progressive.com/CaliforniaCommercialAutoInsuranceRequirements.pdf","Details the minimum required coverage for commercial auto insurance in California."
"TexasBoatInsuranceRequirements","Policy Updates","https://www.progressive.com/TexasBoatInsuranceRequirements.pdf","Details the minimum required coverage for boat insurance in Texas."
"NewYorkAutoInsuranceRequirements","Policy Updates","https://www.progressive.com/NewYorkAutoInsuranceRequirements.pdf","Details the minimum required coverage for auto insurance in New York."
"OhioHomeInsuranceRequirements","Policy Updates","https://www.progressive.com/OhioHomeInsuranceRequirements.pdf","Details the minimum required coverage for home insurance in Ohio."
"WashingtonMotorcycleInsuranceRequirements","Policy Updates","https://www.progressive.com/WashingtonMotorcycleInsuranceRequirements.pdf","Details the minimum required coverage for motorcycle insurance in Washington."


